{
  "schema": "netbox-state/v1",
  "updated_at": "2026-08-27T18:00:00Z",
  "source_agent": "ops-netbox-sot",
  "status": "gaps",
  "headline": "Audit cisco-ai-lab-prod: WAN-01 Gi1 -- WAN-02 Gi1; 1 live/NetBox diff",
  "next_action": "reconcile approved: WAN-01 GigabitEthernet1 enabled false in NetBox, true on box",
  "kind": "netbox",
  "mode": "audit",
  "source": "cml",
  "tenant": "cisco-ai-lab-prod",
  "site": "cisco-ai-lab-prod",
  "seed_match": true,
  "counts": {
    "devices": 2,
    "interfaces": 4,
    "ip_addresses": 4,
    "cables": 1
  },
  "links": [
    {
      "a_device": "WAN-01",
      "a_interface": "GigabitEthernet1",
      "b_device": "WAN-02",
      "b_interface": "GigabitEthernet1"
    }
  ],
  "gaps": [
    "WAN-01 GigabitEthernet1: live enabled true, NetBox enabled false"
  ],
  "details": "inventory/infra-sot.json",
  "netbox_pushed_at": "2026-08-21T20:00:00Z"
}
